{
  "ticket_id": "t_example_food",
  "room": "SYNTHETIC-01",
  "raw_text": "Can I get ice water?",
  "language": "en",
  "category": "food",
  "department": "food",
  "priority": "normal",
  "confidence": 0.95,
  "escalate_to_nurse": false,
  "reason": "Ordinary drink request without a stated restriction.",
  "status": "new",
  "created_at": "2026-10-09T14:03:00Z"
}
